{
  "$schema": "./metadata.schema.json",
  "schema_version": "0.1-community",
  "project": {
    "name": "Proven",
    "summary": "A pull-request reviewer whose every finding carries evidence a reader can check again: a test that fails on the change, or a query through Zetaris and the rows it returned.",
    "licence": "Apache-2.0"
  },
  "track": "The Agent That Can Explain Why",
  "team": {
    "name": "Proven",
    "solo": true,
    "builders": [
      { "name": "Marcin \"Wato\" Marzec", "role": "owner: decides and merges; writes no code" }
    ]
  },
  "repository": "https://github.com/saphan-ai/proven",
  "submission": {
    "demo_video": null,
    "slide_deck": null
  },
  "sponsors": {
    "zetaris": {
      "status": "in-progress",
      "integration_working": true,
      "in_use_case": false,
      "use_case_note": "Proven's REST adapter reaches our local Zetaris and the live-service check proves it answers; in the review scenario today the same SQL still runs over local sample tables, and live Zetaris evidence in a review is being wired in.",
      "how": "The evidence layer: the Investigator proves a finding about a dependency with one SQL query over REST and the rows it returned (CISA KEV, FIRST EPSS, OSV by advisory id). In sample mode the same SQL runs over local sample tables shaped like the Zetaris views; live Zetaris evidence in a review is next.",
      "interface": "rest",
      "deployment": "local-docker",
      "data_sources": ["CISA KEV", "FIRST EPSS", "OSV", "git history"],
      "where": ["internal/query/", "internal/agent/investigator/", "cmd/livecheck/"],
      "evidence": ["docs/SAMPLE_MODE.md", "testdata/fixture/discount/tables.sql", "fleet/infra/zetaris/README.md"],
      "decisions": [
        "fleet/decisions/ADR-0002-evidence-is-a-test-or-a-query-through-zetaris.md",
        "fleet/decisions/ADR-0004-first-evidence-sources.md",
        "fleet/decisions/ADR-0015-zetaris-through-its-rest-api.md",
        "fleet/decisions/ADR-0023-how-proven-s-evidence-is-loaded-through-zetaris.md"
      ]
    },
    "meterless": {
      "status": "in-progress",
      "integration_working": true,
      "in_use_case": true,
      "use_case_note": "H-MEM and the World Model run in every review, sample mode included; the live model calls through Nightshift work, while the sample scenario uses recorded answers.",
      "how": "H-MEM remembers findings refuted in earlier reviews, so they do not come back; the World Model holds the entities a review has seen, and its ingest survives a kill and a restart. Both are a minimum in Go, checked with Meterless's own conformance suites (H-MEM 9 of 13, World Model 7 of 8; the failures are the sections not built yet). Every model call goes through Meterless Nightshift, and the answering model is read from its signed receipt.",
      "engines": ["H-MEM", "World Model"],
      "provider": "nightshift",
      "where": ["internal/hmem/", "internal/world/", "internal/generator/", "conformance/meterless/"],
      "evidence": ["docs/SAMPLE_MODE.md", "docs/ARCHITECTURE.md", "fleet/infra/nvidia/README.md"],
      "decisions": [
        "fleet/decisions/ADR-0003-meterless-engines-in-go.md",
        "fleet/decisions/ADR-0018-meterless-engines-minimum-and-their-contract.md",
        "fleet/decisions/ADR-0019-meterless-nightshift-is-the-primary-ai-provider.md"
      ]
    },
    "cursor": {
      "status": "working",
      "integration_working": true,
      "in_use_case": true,
      "use_case_note": "Cursor is how Proven is built: every product change of day one was coded by a Cursor agent.",
      "how": "Cursor agents write Proven's product code: up to four at once, headless on a Linux machine, each from a signed order, in its own copy of the repository, inside a jail with its own network and an egress door, and with every model request recorded by a proxy. 16 changes were merged on day one.",
      "models": ["grok-4.7-high"],
      "surfaces": ["agent-cli"],
      "where": ["fleet/orders/", "fleet/status/", "fleet/infra/cursor/"],
      "evidence": ["fleet/infra/cursor/README.md", "assets/build/2026-10-22_three-cursor-runs-on-grok.png", "fleet/LEDGER.md"],
      "decisions": [
        "fleet/decisions/ADR-0024-every-cursor-coding-session-is-recorded-and-published.md"
      ]
    },
    "nvidia": {
      "status": "in-progress",
      "integration_working": true,
      "in_use_case": false,
      "use_case_note": "Nemotron answers through Nightshift with signed receipts, and both guardrail backends are built; in the sample scenario a recorded guardrail answers, and the live guardrail in a review is being wired in and tested.",
      "how": "Nemotron answers Proven's agents through Meterless Nightshift, and the Skeptic that tries to refute each finding defaults to Nemotron; an answer that did not come from an NVIDIA model is refused by name. Nemotron 3.5 Content Safety checks every prompt and every answer, on our own model server or through NVIDIA's hosted API.",
      "models": ["nvidia/nemotron-3.5-super-vl-120b-a12b", "Nemotron 3.5 Content Safety"],
      "route": "via-meterless",
      "where": ["internal/generator/", "internal/guardrail/", "internal/agent/skeptic/"],
      "evidence": ["fleet/infra/nvidia/README.md", "docs/CONFIGURATION.md"],
      "decisions": [
        "fleet/decisions/ADR-0005-guardrail-on-by-default.md",
        "fleet/decisions/ADR-0006-a-skeptic-from-another-model-family.md",
        "fleet/decisions/ADR-0019-meterless-nightshift-is-the-primary-ai-provider.md"
      ]
    }
  },
  "pre_existing": [
    {
      "name": "Saphan Studio",
      "what": "The platform that runs the agent fleet building Proven: orders, runs, reviews and their record. A tool used to build, not part of the product.",
      "where": ["not in this repository"]
    },
    {
      "name": "Test corpus",
      "what": "21 test-case contracts from 28 real review disagreements, declared as prior art; their executable tests are written inside the build window.",
      "where": ["tests/"],
      "since": "2026-10-19"
    }
  ],
  "run": {
    "setup": "docs/SAMPLE_MODE.md",
    "sample_mode": true,
    "secrets": ["METERLESS_RUNTIME_TOKEN", "ZETARIS_API_KEY", "ZETARIS_ORG_ID", "PROVEN_GUARDRAIL_KEY"]
  },
  "evidence_logs": "logs/"
}
